{
  "$schema": "https://json-schema.org/draft/2020-12/schema",
  "$id": "https://raw.githubusercontent.com/conuti-gmbh/bo4e-schema/master/schemas/v1/bo/AdHocSteuerkanal.schema.json",
  "title": "AdHocControlChannel",
  "type": "object",
  "properties": {
    "boType": {
      "$ref": "../enum/BOType.schema.json",
      "default": "AD_HOC_CONTROL_CHANNEL"
    },
    "structureVersion": {
      "type": "string",
      "default": "1",
      "description": "versionStruktur"
    },
    "configurationProduct": {
      "type": "string",
      "faker": {
        "string.numeric": 14
      },
      "description": "konfigurationsprodukt"
    },
    "targetAddress": {
      "$ref": "../com/TargetAddress.schema.json"
    },
    "issuer": {
      "$ref": "../com/Issuer.schema.json"
    },
    "certificateUser": {
      "$ref": "../com/CertificateUser.schema.json"
    },
    "IpAddressClsDevice": {
      "$ref": "../com/IpAddressClsDevice.schema.json"
    }
  },
  "required": [
    "boType",
    "structureVersion"
  ]
}